{"bagJson":1,"definition":{"kind":"STATIC_BASKET","chain":"robinhood","mutability":"MUTABLE","assets":[{"chain":"robinhood","address":"0x322f0929c4625ed5bad873c95208d54e1c003b2d","decimals":18,"weightBps":5000},{"chain":"robinhood","address":"0xd0601ce157db5bdc3162bbac2a2c8af5320d9eec","decimals":18,"weightBps":5000}],"rules":{"weightBounds":{"minBps":100,"maxBps":7000},"maxAssets":10,"minInvestment":{"amount":"0","measuredAs":"PAYMENT_TOKEN_AMOUNT"},"swapSlippageBps":100,"rebalance":{"frequency":"MANUAL","driftThresholdBps":500},"performanceFeeBps":2000,"noRouteAssetPolicy":"BLOCK"}},"definitionHash":"0x089fc9ba2754f4180658c5f809986e606f8ec63d55430e3ab33da2046210a4fa","ref":{"strategyId":"170e5e72-d5d5-4f16-b180-24b3dc525b37","version":1,"parentVersion":null,"createdAt":"2026-10-07T09:59:13.243134+00:00"},"network":{"chainId":4663},"metadata":{"name":"feetest","symbol":"FEETEST","description":"fee test for + pnl","assets":[{"chain":"robinhood","address":"0x322f0929c4625ed5bad873c95208d54e1c003b2d","symbol":"TSLA"},{"chain":"robinhood","address":"0xd0601ce157db5bdc3162bbac2a2c8af5320d9eec","symbol":"NVDA"}]}}
